{
  "schema": "insight.v1",
  "event_id": "cbr-2026-09-11",
  "run_id": "862d-0ee4",
  "company_id": "U-10482",
  "title": "ЦБ сохранил ключевую ставку 14%: кредиты для «СеверТопливо» не подешевеют до конца года",
  "summary": "Совет директоров Банка России взял паузу после десяти снижений подряд и ужесточил риторику.",
  "published_at": "2026-09-11T13:30:00+03:00",
  "topics": ["rates"],
  "relevance": 0.94,
  "impact": "risk",
  "why_you": "кредитный портфель в Альфа-Банке · инвестпрограмма на заёмные средства",
  "facts": [
    {
      "text": "11 сентября 2026 года Совет директоров Банка России сохранил ключевую ставку на уровне 14% годовых — первая пауза после десяти снижений подряд с июня 2025 года. Риторика регулятора стала жёстче.",
      "src": ["cbr", "ifx-rate"]
    }
  ],
  "bank_view": [
    {
      "text": "Центр макроэкономических исследований Альфа-Банка: ставка без изменения, риторика жёстче. Данные по рынку труда не подтверждают охлаждения экономики — возобновления снижения стоит ждать не раньше декабря.",
      "src": ["cmi-rate", "cmi-macro"]
    }
  ],
  "ai_inference": [
    {
      "kind": "why_relevant",
      "text": "У «СеверТопливо» кредитная линия 250 млн ₽ по ставке КС + 3,1% и инвестпрограмма на заёмные средства. Ставка по линии остаётся 17,1% вместо ожидавшихся после снижения ~16%.",
      "features": ["CL_PRODUCT_LOA_MARK", "CL_INVEST_PROGRAM"]
    },
    {
      "kind": "consequence_risk",
      "text": "Каждый 1 п.п. ставки выше плана — около +0,6 млн ₽ процентов за квартал при полной выборке лимита; дорожает пополнение оборотки в сезон закупок ДТ.",
      "features": ["CL_PRODUCT_LOA_MARK", "OKVED_MAIN"]
    },
    {
      "kind": "consequence_opportunity",
      "text": "Депозит 120 млн ₽ продолжит приносить ~16%, досрочное гашение невыгодно.",
      "features": ["CL_PRODUCT_DEP_MARK"]
    }
  ],
  "actions": [
    { "id": "a1", "text": "Пересчитать бюджет процентных расходов на IV квартал при КС 14%.", "roles": ["cfo", "treasurer"] },
    { "id": "a2", "text": "Обсудить фиксацию ставки на часть лимита.", "roles": ["cfo", "ceo"], "product": "IRS" },
    { "id": "a3", "text": "Финансировать закупку ДТ с депозита, если спред выше 1 п.п.", "roles": ["treasurer", "procurement"] }
  ],
  "sources": [
    {
      "id": "cbr",
      "kind": "regulator",
      "publisher": "Банк России",
      "title": "Пресс-релиз о ключевой ставке",
      "url": "https://www.cbr.ru/press/keypr/",
      "published_at": "2026-09-11T13:30:00+03:00"
    },
    {
      "id": "cmi-rate",
      "kind": "bank_research",
      "publisher": "ЦМИ Альфа-Банка",
      "title": "Ставка без изменения на 14,0%, риторика стала жестче",
      "url": "https://alfabank.ru/corporate/",
      "published_at": "2026-09-11T15:10:00+03:00"
    },
    {
      "id": "cmi-macro",
      "kind": "bank_research",
      "publisher": "ЦМИ Альфа-Банка",
      "title": "Макростатистика 7М26",
      "url": "https://alfabank.ru/corporate/",
      "published_at": "2026-09-02T10:00:00+03:00"
    },
    {
      "id": "ifx-rate",
      "kind": "news",
      "publisher": "Интерфакс",
      "title": "ЦБ взял паузу в снижении ставки",
      "url": "https://www.interfax.ru/business/",
      "published_at": "2026-09-11T13:34:00+03:00"
    }
  ],
  "features": [
    { "code": "CL_PRODUCT_LOA_MARK", "label": "Кредитная линия с плавающей ставкой", "weight": 0.92 },
    { "code": "CL_INVEST_PROGRAM", "label": "Инвестпрограмма на заёмные средства", "weight": 0.71 },
    { "code": "CL_PRODUCT_DEP_MARK", "label": "Депозит 120 млн ₽", "weight": 0.48 },
    { "code": "OKVED_MAIN", "label": "Сезон закупок ДТ (ОКВЭД 46.71)", "weight": 0.36 }
  ],
  "confidence": "high",
  "basis": "2 новостных источника · 2 материала ЦМИ Альфа-Банка · 4 признака компании. Противоречие между источниками устранено повторным поиском, уверенность высокая.",
  "trace": [
    {
      "title": "1. Планирование",
      "tool": "planner",
      "detail": "Цель: оценить влияние события на U-10482. План: профиль → первоисточник → аналитика банка → расчёт → самопроверка → сборка.",
      "time": 0.6,
      "state": "done"
    },
    {
      "title": "2. Профиль клиента",
      "tool": "get_client_profile(U-10482)",
      "detail": "ОКВЭД 46.71 · выручка 38 млрд ₽ · CL_PRODUCT_LOA_MARK = 1 · GROUP_ID G-311 · топ-5 контрагентов по платежам.",
      "time": 0.2,
      "state": "done"
    },
    {
      "title": "3. Поиск новостей",
      "tool": "news_search('ключевая ставка', 48h)",
      "detail": "Найдено 4 публикации, 2 дубля объединены, 2 источника оставлено.",
      "time": 1.1,
      "state": "done"
    },
    {
      "title": "4. RAG по аналитике Альфа-Банка",
      "tool": "rag_alfa_research(k=5)",
      "detail": "2 релевантных материала ЦМИ: «Ставка без изменения на 14,0%, риторика стала жестче», «Макростатистика 7М26».",
      "time": 1.4,
      "state": "done"
    },
    {
      "title": "5. Самопроверка",
      "tool": "verifier → news_search(source='cbr.ru')",
      "detail": "Противоречие: Интерфакс датирует решение 12.09. Повторный поиск по первоисточнику — дата 11.09 подтверждена Банком России.",
      "time": 2.3,
      "state": "retry"
    },
    {
      "title": "6. Расчёт влияния",
      "tool": "calc_interest_impact(limit=250 млн, Δ=1 п.п.)",
      "detail": "≈ 0,63 млн ₽ процентов за квартал на каждый 1 п.п. при полной выборке.",
      "time": 0.1,
      "state": "done"
    },
    {
      "title": "7. Сборка инсайта",
      "tool": "compose_insight(schema=insight.v1)",
      "detail": "6 блоков, 7 ссылок на источники и признаки, разметка origin: fact / bank / ai.",
      "time": 4.1,
      "state": "done"
    }
  ],
  "bank_offer": {
    "title": "Предложение Альфа-Банка",
    "text": "Процентный своп или фиксированная ставка на часть кредитной линии — защитит бюджет, если снижение ставки отложится.",
    "product": "IRS"
  },
  "suggested_questions": [
    "Сколько мы переплатим за IV квартал?",
    "Как это влияет на группу компаний G-311?",
    "Покажи прогноз ставки по мнению банка",
    "Что пишут первоисточники?"
  ]
}
